FieldName,description_en,description_fr,type_en,type_fr
Year__année,Year of green crab monitoring,Année de surveillance du crabe vert Européen,Numeric,Numérique
Estuary__estuaire,Coastal waterbody ecosystem,Écosystème de la zone côtière,Text,Texte
Site__lieu,Specific sampling location name within the overall estuary,Nom du site de prélèvement spécifique au sein de l'estuaire,Text,Texte
Date trap set__date piège posé,Date and time of trap setting ,Date et l'heure de déploiement du piège ,Date (MM/DD/YYYY HH:MM),Date (MM/JJ/AAAA HH:MM)
Date trap fished__date piège remonté,Date and time of trap fishing ,Date de l'heure de récupération du piège ,Date (MM/DD/YYYY HH:MM),Date (MM/JJ/AAAA HH:MM)
Trap ID__ID de piège,Trap identifier,Identifiant de piège,Numeric,Numérique
Latitude,"The exact location of the trap (in decimal degrees).  The geographic latitude (in decimal degrees, using the spatial reference system given in dwc:geodeticDatum). Positive values are north of the Equator, negative values are south of it.  Legal values lie between -90 and 90, inclusive.","Le lieu exact de l'emplacement du piège (en degrés décimaux).  La latitude géographique (en degrés décimaux, en utilisant le système de référence spatiale indiqué dans dwc:geodeticDatum). Les valeurs positives correspondent au nord de l'équateur, les valeurs négatives au sud de l'équateur.  Les valeurs légales sont comprises entre -90 et 90, inclusivement.","Numeric, positive for this region","Numérique, positif pour cette région"
Longitude,"The exact location of the survey station (in decimal degrees).  The geographic longitude (in decimal degrees, using the spatial reference system given in dwc:geodeticDatum). Positive values are east of the Greenwich Meridian, negative values are west of it.  Legal values lie between -180 and 180, inclusive.","Le lieu exact de l'emplacement de la station (en degrés décimaux).  La longitude géographique (en degrés décimaux, en utilisant le système de référence spatiale indiqué dans dwc:geodeticDatum). Les valeurs positives correspondent à l'est du méridien de Greenwich, les valeurs négatives à l'ouest.  Les valeurs légales sont comprises entre -180 et 180 inclus.","Numeric, negative symbol for this region","Numérique, négatif pour cette région"
Trap type,Type of trap used.  Details available here: https://waves-vagues.dfo-mpo.gc.ca/library-bibliotheque/41076552.pdf)   ,Type de piège. Plus de détails: https://waves-vagues.dfo-mpo.gc.ca/library-bibliotheque/41076552.pdf ,Text,Texte
Type de piège,Type of trap used.  Details available here: https://waves-vagues.dfo-mpo.gc.ca/library-bibliotheque/41076552.pdf)   ,Type de piège. Plus de détails: https://waves-vagues.dfo-mpo.gc.ca/library-bibliotheque/41076552.pdf ,Text,Texte
Bait type,Bait used in the trap.  Bait was in a bait can or bag,L'appât mis dans le piège.  L'appât se trouvait dans une boîte ou un sac,Text,Texte
Type d'appât,Bait used in the trap.  Bait was in a bait can or bag,L'appât mis dans le piège.  L'appât se trouvait dans une boîte ou un sac,Text,Texte
Effort (hours/heures),"Hours the trap was in the water (actively fishing) calculated from set and fishing date/time.  Note that traps that did not fish correctly were not included.  Examples of traps not fishing correctly include the trap having opened, the bait can open, trap full of algae and sagging open, trap not fished for over 48 hours, trap upended, or the trap was moved significantly or otherwise disturbed.  ","Nombre d'heures pendant lesquelles le piège est resté dans l'eau calculé à partir de la date et de l'heure de pose et de pêche. Veuillez noter que les pièges qui n'ont pas fonctionné correctement n'ont pas été pris en compte. Parmi les exemples de pièges défectueux, on peut citer : un piège ouvert, un récipient à appât ouvert, un piège rempli d'algues et tombant en position ouverte, un piège non-pêché  depuis plus de 48 heures, un piège renversé, ou encore un piège ayant été déplacé de manière significative ou altéré d'une autre manière.  ",Numeric,Numérique
European Green Crab (EGC)__crabe vert Européen (CVE),Count of European green crabs present in the trap upon fishing.,Nombre de crabes verts Européen présents dans le piège au moment de la pêche.,Numeric,Numérique
Total wt EGC__poids total CVE (kg),"Weight of European green crabs present in traps upon fishin (in kilgrams) ""--"" indicates that no weight was recorded.  Note that weights are not reported here for PEI sites due to inconsistencies with types of weighing scales and measurement protocols.",Poids des crabes verts Européen présents dans le piège au moment de la pêche (en kilogrammes). « -- » signifie qu'aucun poids n'a été effectué. Les poids ne sont pas indiqués pour les sites de l'Île-du-Prince-Édouard en raison d'incohérences au niveau des balances et des protocols de mesure.,Numeric,Numérique
Lobster__homard,Count of lobsters (Homarus americanus) present in trap at time of fishing,Nombre de homards (Homarus americanus) présents dans le piège au moment de la pêche,Text,Texte
Rock Crab__crabe commun,Count of rock crabs (Cancer irroratus) present in trap at time of fishing,Nombre de crabes de roche (Cancer irroratus) présents dans le piège au moment de la pêche,Text,Texte
Finfish__poissons à nageoires,Count of individuals of all species of finish  that were typically large enough to be caught in the trap that were present in the trap at time of fishing.  Small fish species like stickelbacks were not included as they can easily escape the mesh size. ,"Nombre d'individus de toutes les espèces de poissons qui étaient suffisamment gros pour être capturés dans le piège et qui se trouvaient dans celui-ci au moment de la pêche. Les espèces de petits poissons, comme les épinoches, n'ont pas été prises en compte, car elles peuvent facilement passer à travers les mailles du filet. ",Text,Texte
Other species__autres espèces,"Count of individuals of other species present in trap at time of fishing. This could include jellyfish, moon snails and other species large enough to be caught in the trap but not captured in other categories","Nombre d'individus d'autres  espèces présentes dans le piège au moment de la pêche. Cela peut inclure les méduses, les limaces de mer et d'autres espèces suffisamment grandes pour être piégées, mais qui ne sont pas classées dans les autres catégories",Text,Texte
Depth at set__profondeur du piège (m),"Water depth when the trap was set (metres). If depth was not recorded, it was estimated based on tidal information and knowledge of the location.  In some cases, an estimate was not possible, no depth was entered.","Profondeur de l'eau au déploiement du piège (mètres). Si la profondeur n'avait pas été notée, elle a été estimée à partir des données sur les marées et de la connaissance du site. Dans certains cas, aucune estimation n'a pu être effectuée et aucune profondeur n'a donc été saisie.",Numeric,Numérique
Probe Measurement (fished/set),"Time the probe measurement data was noted (when traps were set or fished).  Probe types were various models of YSI multimeter or thermometer and refractometer depending on what was availble when the trap site was visited. This value is mainly ""fished"", but where no measurement was taken then, the ""set"" values were used.","Le moment où les données de mesure ont été relevées (lors du déploiement ou la récupération du piège). L'instrument utilisé était un des divers modèles de multimètres, de thermomètres ou de réfractomètres YSI, en fonction de ce qui était disponible lors de la visite sur le site du piège. Cette valeur est principalement au moment de « récupération », mais lorsque aucune mesure n'a été relevée, ce sont les valeurs de « déploiement » qui ont été utilisées.",Text,Texte
Mesure de sonde (récupération/déploiement),"Time the probe measurement data was noted (when traps were set or fished).  Probe types were various models of YSI multimeter or thermometer and refractometer depending on what was availble when the trap site was visited. This value is mainly ""fished"", but where no measurement was taken then, the ""set"" values were used.","Le moment où les données de mesure ont été relevées (lors du déploiement ou la récupération du piège). L'instrument utilisé était un des divers modèles de multimètres, de thermomètres ou de réfractomètres YSI, en fonction de ce qui était disponible lors de la visite sur le site du piège. Cette valeur est principalement au moment de « récupération », mais lorsque aucune mesure n'a été relevée, ce sont les valeurs de « déploiement » qui ont été utilisées.",Text,Texte
Temperature__température (°C),"Water temperature reading (°C). ""--"" means no measurement was available.",Température de l'eau (°C). « -- » signifie qu'aucune mesure n'était disponible.,Numeric,Numérique
Salinity (ppt)__salinité (ppm),"Water salinity, in parts per thousand (ppt).  ""--"" means no measurement was available.","Salinité de l'eau, en paftie par millier (ppm).  « -- » signifie qu'aucune mesure n'était disponible.",Numeric,Numérique
Tide,"State of tide (high, med, or low) and tide direction (incoming/outgoing)","État de la marée (haute, moyenne ou basse) et sens de la marée (montante/descendante)",Text,Texte
Marée,"State of tide (high, med, or low) and tide direction (incoming/outgoing)","État de la marée (haute, moyenne ou basse) et sens de la marée (montante/descendante)",Text,Texte
Weather,Weather conditions at fishing,Conditions météorologiques à la récupération du piège,Text,Texte
Météo,Weather conditions at fishing,Conditions météorologiques à la récupération du piège,Text,Texte
Sediment,Sediment type in the trap area,Type de sédiments dans la zone du piège,Text,Texte
Sédiment,Sediment type in the trap area,Type de sédiments dans la zone du piège,Text,Texte
Vegetation,The vegetation species observed in the trapping area (vernacular or common name). Common names are not capitalized unless they are based on a place or a person’s name.,"Le nom d'espèces de végétation observées près du piège  (vernaculaire ou commun). Les noms communs ne prennent pas de majuscule, sauf s'ils sont basés sur un nom de lieu ou de personne.",Text,Texte
Végétation,The vegetation species observed in the trapping area (vernacular or common name). Common names are not capitalized unless they are based on a place or a person’s name.,"Le nom d'espèces de végétation observées près du piège  (vernaculaire ou commun). Les noms communs ne prennent pas de majuscule, sauf s'ils sont basés sur un nom de lieu ou de personne.",Text,Texte
