name__nom,description_en,description_fr
date,Tow date,Date du chalutage
set__trait,Unique identifier for each tow,Identifiant unique pour chaque trait
set_number__numéro_trait,Tow numbering used on survey,Numéro du trait de chalut utilisé sur le relevé
species__espèces,Species code,Code de l'espèce
species_name__nom_espèces,Species common name,Nom commun de l'espèce
number_caught__quantité_capturé,The count of the species caught in the set,Le compte de l'espèce capturé dans le trait
weight_caught__poids_capturé,The weight in kg of the species caught in the set,Le poids en kg de l'espèce capturé dans le trait
comment__commentaire,Comments,Commentaires
