Data Dictionary - dictionnaire des données,,,
sweep_number__numéro_de_balayage,specimen data / données sur les échantillons,"Sweep number is used to identify what samples came from what sweep. Catch per unit effort (CPUE) sweeps are always indicated as 0.5. If a sweep has a whole number above 0.5, it is considered a depletion sweep. Depletion sweeps only appear at sites that were done as closed. For more information about CPUE sweeps and closed sites, please refer to the electrofishing protocol.","Le numéro de balayage est utilisé pour identifier quels échantillons proviennent de quel balayage. Les balayages de capture par unité d'effort (BCUE) sont toujours indiqués comme 0,5. Si un balayage a un nombre entier supérieur à 0,5, il est considéré comme un balayage d'épuisement. Les balayages d'épuisement n'apparaissent que sur les sites qui ont été fermés. Pour plus d'informations sur les balayages BCUE et les sites fermés, veuillez vous référer au protocole de pêche électrique."
sweep_time__temps_de_balayage,specimen data / données sur les échantillons,Sweep time indicates how many seconds were used to complete the sweep.,La durée du balayage indique le nombre de secondes utilisées pour effectuer le balayage.
total_length__longueur_totale,specimen data / données sur les échantillons,Measured in millimeters (mm).,Mesuré en millimètres (mm).
weight__poids,specimen data / données sur les échantillons,Measured in grams (g).,Mesuré en grammes (g).
Avg. length (mm),wms,Average (mean) length of specimens measured in millimeters.,Longueur moyenne (moyenne) des spécimens mesurée en millimètres.
CGNDB,wms,Reference number in the Canadian Geographical Names Database (CGNDB).,Numéro de référence dans la Base de données toponymiques du Canada (BDTC).
ITIS TSN,wms,The unique identifier for the Integrated Taxonomic Information System (ITIS).,L'identifiant unique du système intégré d'information taxonomique (SITI).
Length type,wms,Length type used for length measurement.,Type de longueur utilisé pour la mesure de la longueur.
Longueur moyenne (mm),wms,Average (mean) length of specimens measured in millimeters.,Longueur moyenne (moyenne) des spécimens mesurée en millimètres.
Specimens measured,wms,A total count of the specimens.,Nombre total de spécimens.
Spécimens mesurés,wms,A total count of the specimens.,Nombre total de spécimens.
Type de longueur,wms,Length type used for length measurement.,Type de longueur utilisé pour la mesure de la longueur.
